{
  "schema_version": "1.0.0",
  "poi_id": "poi_ayasofya",
  "name": "Hagia Sophia",
  "aliases": ["Ayasofya"],
  "district_id": "district_fatih",
  "side": "european",
  "coordinates": { "lat": 41.0086, "lon": 28.9802 },
  "category": "heritage_site",
  "citations": [
    {
      "schema_version": "1.0.0",
      "source_id": "src_hagia_sophia_history_001",
      "title": "Hagia Sophia — Historical Overview",
      "retrieved_at": "2026-08-01T12:00:00Z",
      "chunk_ids": ["chunk_0012"]
    }
  ]
}
